{
  "version": "http://json-schema.org/to-be-done/schema#",
  "display": "",
  "cohortDefinition": {
    "version": "http://to_be_decided.com/draft-1/schema#",
    "display": "",
    "inclusionCriteria": [
      [
        {
          "termCodes": [
            {
              "code": "263495000",
              "system": "http://snomed.info/sct",
              "display": "Geschlecht"
            }
          ],
          "context": {
            "code": "Patient",
            "system": "fdpg.mii.cds",
            "version": "1.0.0",
            "display": "Patient"
          },
          "valueFilter": {
            "selectedConcepts": [
              {
                "code": "female",
                "display": "Female",
                "system": "http://hl7.org/fhir/administrative-gender"
              },
              {
                "code": "male",
                "display": "Male",
                "system": "http://hl7.org/fhir/administrative-gender"
              }
            ],
            "type": "concept"
          }
        }
      ]
    ]
  },
  "dataExtraction": {
    "attributeGroups": [
      {
        "id": "1234",
        "name": "Observation",
        "groupReference": "https://www.medizininformatik-initiative.de/fhir/core/modul-labor/StructureDefinition/ObservationLab",
        "attributes": [
          {
            "attributeRef": "Observation.encounter",
            "mustHave": true,
            "linkedGroups": [
              "985"
            ]
          }
        ],
        "filter": []
      },
      {
        "id": "Observation2",
        "name": "Observation2",
        "groupReference": "https://www.medizininformatik-initiative.de/fhir/core/modul-labor/StructureDefinition/ObservationLab",
        "attributes": [
          {
            "attributeRef": "Observation.id",
            "mustHave": false
          }
        ],
        "filter": []
      },
      {
        "id": "985",
        "name": "Encounter",
        "includeReferenceOnly": true,
        "groupReference": "https://www.medizininformatik-initiative.de/fhir/core/modul-fall/StructureDefinition/KontaktGesundheitseinrichtung",
        "attributes": [
        ]
      }
    ]
  }
}
