{
  "version": "http://json-schema.org/to-be-done/schema#",
  "display": "",
  "cohortDefinition": {
    "version": "http://to_be_decided.com/draft-1/schema#",
    "display": "Ausgewählte Merkmale",
    "inclusionCriteria": [
      [
        {
          "termCodes": [
            {
              "code": "2.16.840.1.113883.3.1937.777.24.5.3.8",
              "display": "MDAT wissenschaftlich nutzen EU DSGVO NIVEAU",
              "system": "urn:oid:2.16.840.1.113883.3.1937.777.24.5.3",
              "version": "1.0.7"
            }
          ],
          "context": {
            "code": "Einwilligung",
            "display": "Einwilligung",
            "system": "fdpg.mii.cds",
            "version": "1.0.0"
          }
        }
      ],
      [
        {
          "termCodes": [
            {
              "code": "2.16.840.1.113883.3.1937.777.24.5.3.6",
              "display": "MDAT erheben",
              "system": "urn:oid:2.16.840.1.113883.3.1937.777.24.5.3",
              "version": "1.0.7"
            }
          ],
          "context": {
            "code": "Einwilligung",
            "display": "Einwilligung",
            "system": "fdpg.mii.cds",
            "version": "1.0.0"
          }
        }
      ],
      [
        {
          "termCodes": [
            {
              "code": "263495000",
              "display": "Geschlecht",
              "system": "http://snomed.info/sct",
              "version": ""
            }
          ],
          "context": {
            "code": "Patient",
            "display": "Patient",
            "system": "fdpg.mii.cds",
            "version": "1.0.0"
          },
          "valueFilter": {
            "selectedConcepts": [
              {
                "code": "female",
                "display": "Female",
                "system": "http://hl7.org/fhir/administrative-gender"
              },
              {
                "code": "male",
                "display": "Male",
                "system": "http://hl7.org/fhir/administrative-gender"
              },
              {
                "code": "other",
                "display": "Other",
                "system": "http://hl7.org/fhir/administrative-gender"
              },
              {
                "code": "unknown",
                "display": "Unknown",
                "system": "http://hl7.org/fhir/administrative-gender"
              }
            ],
            "type": "concept"
          }
        }
      ]
    ]
  },
  "dataExtraction": {
    "attributeGroups": [
      {
        "attributes": [
          {
            "attributeRef": "Patient.active",
            "mustHave": false
          },
          {
            "attributeRef": "Patient.gender",
            "mustHave": true
          },
          {
            "attributeRef": "Patient.birthDate",
            "mustHave": true
          }
        ],
        "id": "6abd6380-c1ad-4ac0-aa98-fe40a58437f1",
        "groupReference": "https://www.medizininformatik-initiative.de/fhir/core/modul-person/StructureDefinition/PatientPseudonymisiert",
        "name": "MII PR Person Patient (Pseudonymisiert)"
      },
      {
        "attributes": [
          {
            "attributeRef": "Consent.category",
            "mustHave": false
          },
          {
            "attributeRef": "Consent.dateTime",
            "mustHave": false
          },
          {
            "attributeRef": "Consent.policy",
            "mustHave": false
          },
          {
            "attributeRef": "Consent.provision",
            "mustHave": false
          },
          {
            "attributeRef": "Consent.status",
            "mustHave": false
          }
        ],
        "id": "605c5b82-8403-44c0-98b3-182fd7d4e825",
        "groupReference": "https://www.medizininformatik-initiative.de/fhir/modul-consent/StructureDefinition/mii-pr-consent-einwilligung",
        "name": "Profile - MI-I - Consent - Einwilligung"
      }
    ]
  }
}
