{
  "version": "http://json-schema.org/to-be-done/schema#",
  "display": "",
  "cohortDefinition": {
    "version": "http://to_be_decided.com/draft-1/schema#",
    "display": "",
    "inclusionCriteria": [
      [
        {
          "termCodes": [
            {
              "code": "424144002",
              "system": "http://snomed.info/sct",
              "display": "Gegenwärtiges chronologisches Alter"
            }
          ],
          "context": {
            "code": "Patient",
            "system": "fdpg.mii.cds",
            "version": "1.0.0",
            "display": "Patient"
          },
          "valueFilter": {
            "type": "quantity-comparator",
            "unit": {
              "code": "a",
              "display": "a"
            },
            "value": 1,
            "comparator": "le"
          }
        }
      ],
      [
        {
          "termCodes": [
            {
              "code": "263495000",
              "system": "http://snomed.info/sct",
              "display": "Geschlecht"
            }
          ],
          "context": {
            "code": "Patient",
            "system": "fdpg.mii.cds",
            "version": "1.0.0",
            "display": "Patient"
          },
          "valueFilter": {
            "selectedConcepts": [
              {
                "code": "female",
                "display": "Female",
                "system": "http://hl7.org/fhir/administrative-gender"
              }
            ],
            "type": "concept"
          }
        }
      ],
      [
        {
          "termCodes": [
            {
              "code": "8-918",
              "system": "http://fhir.de/CodeSystem/bfarm/ops",
              "version": "2023",
              "display": "Interdisziplinäre multimodale Schmerztherapie"
            }
          ],
          "context": {
            "code": "Procedure",
            "system": "fdpg.mii.cds",
            "version": "1.0.0",
            "display": "Prozedur"
          }
        }
      ]
    ]
  },
  "dataExtraction": {
    "attributeGroups": [
      {
        "id": "ObservationNotContained",
        "groupReference": "https://www.medizininformatik-initiative.de/fhir/core/modul-labor/StructureDefinition/ObservationLab",
        "attributes": [
          {
            "attributeRef": "Observation.code",
            "mustHave": true
          },
          {
            "attributeRef": "Observation.value[x]",
            "mustHave": true
          }
        ],
        "filter": []
      }
    ]
  }
}





