{
  "version": "http://json-schema.org/to-be-done/schema#",
  "display": "",
  "cohortDefinition": {
    "version": "http://to_be_decided.com/draft-1/schema#",
    "display": "",
    "inclusionCriteria": [
      [
        {
          "termCodes": [
            {
              "code": "263495000",
              "system": "http://snomed.info/sct",
              "display": "Geschlecht"
            }
          ],
          "context": {
            "code": "Patient",
            "system": "fdpg.mii.cds",
            "version": "1.0.0",
            "display": "Patient"
          },
          "valueFilter": {
            "selectedConcepts": [
              {
                "code": "female",
                "display": "Female",
                "system": "http://hl7.org/fhir/administrative-gender"
              },
              {
                "code": "male",
                "display": "Male",
                "system": "http://hl7.org/fhir/administrative-gender"
              }
            ],
            "type": "concept"
          }
        }
      ]
    ]
  },
  "dataExtraction": {
    "attributeGroups": [
      {
        "id": "111bea",
        "groupReference": "https://www.medizininformatik-initiative.de/fhir/core/modul-person/StructureDefinition/Vitalstatus",
        "attributes": [
          {
            "attributeRef": "Observation.id",
            "mustHave": true
          },
          {
            "attributeRef": "Observation.value[x]",
            "mustHave": false
          }
        ]
      },
      {
        "id": "111-pat",
        "groupReference": "https://www.medizininformatik-initiative.de/fhir/core/modul-person/StructureDefinition/PatientPseudonymisiert",
        "attributes": [
          {
            "attributeRef": "Patient.id",
            "mustHave": true
          }
        ]
      }
    ]
  }
}
