{
  "display": "",
  "version": "http://json-schema.org/to-be-done/schema#",
  "cohortDefinition": {
    "version": "http://to_be_decided.com/draft-1/schema#",
    "display": "Ausgewählte Merkmale",
    "inclusionCriteria": [
      [
        {
          "termCodes": [
            {
              "code": "263495000",
              "display": "Geschlecht",
              "system": "http://snomed.info/sct",
              "version": ""
            }
          ],
          "context": {
            "code": "Patient",
            "display": "Patient",
            "system": "fdpg.mii.cds",
            "version": "1.0.0"
          },
          "valueFilter": {
            "selectedConcepts": [
              {
                "code": "female",
                "display": "Female",
                "system": "http://hl7.org/fhir/administrative-gender",
                "version": "2099"
              }
            ],
            "type": "concept"
          }
        }
      ]
    ]
  },
  "dataExtraction": {
    "attributeGroups": [
      {
        "id": "diag-1-diab",
        "name": "Diabetes Diagnosis (Main Diagnosis)",
        "groupReference": "https://www.medizininformatik-initiative.de/fhir/core/modul-diagnose/StructureDefinition/Diagnose",
        "attributes": [
          {
            "attributeRef": "Condition.subject",
            "mustHave": true,
            "linkedGroups": ["pat-1-main"]
          },
          {
            "attributeRef": "Condition.encounter",
            "mustHave": true,
            "linkedGroups": ["enc-1-diab-enc"]
          },
          {
            "attributeRef": "Condition.clinicalStatus",
            "mustHave": false
          },
          {
            "attributeRef": "Condition.verificationStatus",
            "mustHave": false
          },
          {
            "attributeRef": "Condition.code",
            "mustHave": false
          },
          {
            "attributeRef": "Condition.recordedDate",
            "mustHave": false
          }
        ],
        "filter": [
          {
            "type": "token",
            "name": "code",
            "codes": [
              {
                "code": "E13.0",
                "display": "Sonstiger näher bezeichneter Diabetes mellitus: Mit Koma",
                "system": "http://fhir.de/CodeSystem/bfarm/icd-10-gm",
                "version": "2099"
              }
            ]
          }
        ]
      },
      {
        "id": "diag-2-other-diab-enc-diagnoses",
        "name": "Other Diagnoses for Diab Enc",
        "includeReferenceOnly": true,
        "groupReference": "https://www.medizininformatik-initiative.de/fhir/core/modul-diagnose/StructureDefinition/Diagnose",
        "attributes": [
          {
            "attributeRef": "Condition.subject",
            "mustHave": true,
            "linkedGroups": ["pat-1-main"]
          },
          {
            "attributeRef": "Condition.encounter",
            "mustHave": false,
            "linkedGroups": ["enc-1-diab-enc"]
          },
          {
            "attributeRef": "Condition.clinicalStatus",
            "mustHave": false
          },
          {
            "attributeRef": "Condition.verificationStatus",
            "mustHave": false
          },
          {
            "attributeRef": "Condition.code",
            "mustHave": false
          },
          {
            "attributeRef": "Condition.recordedDate",
            "mustHave": false
          }
        ]
      },
      {
        "id": "pat-1-main",
        "name": "Main Pat for Extraction",
        "groupReference": "https://www.medizininformatik-initiative.de/fhir/core/modul-person/StructureDefinition/Patient",
        "attributes": [
          {
            "attributeRef": "Patient.active",
            "mustHave": false
          },
          {
            "attributeRef": "Patient.deceased[x]",
            "mustHave": false
          },
          {
            "attributeRef": "Patient.gender",
            "mustHave": false
          }
        ]
      },
      {
        "id": "enc-1-diab-enc",
        "name": "Diabetes Encounter",
        "groupReference": "https://www.medizininformatik-initiative.de/fhir/core/modul-fall/StructureDefinition/KontaktGesundheitseinrichtung",
        "attributes": [
          {
            "attributeRef": "Encounter.subject",
            "mustHave": true,
            "linkedGroups": ["pat-1-main"]
          },
          {
            "attributeRef": "Encounter.status",
            "mustHave": false
          },
          {
            "attributeRef": "Encounter.class",
            "mustHave": false
          },
          {
            "attributeRef": "Encounter.diagnosis.condition",
            "mustHave": false,
            "linkedGroups": ["diag-2-other-diab-enc-diagnoses"]
          }
        ]
      }
    ]
  }
}